{
  "profile": "surface",
  "kind": "surface_health",
  "state": "ready",
  "ready": true,
  "owner_ura": "easynet:///r/example/agent/alice.pages",
  "surface_ref": "easynet:///r/example/resource/alice.docs",
  "descriptor_ref": "easynet:///r/example/ability/alice.pages.pages.health@1.0.0",
  "descriptor_version": "1.0.0",
  "page_count": 1,
  "checks": [
    {
      "name": "manifest",
      "state": "ready",
      "ready": true,
      "message": null,
      "latency_ms": 3,
      "metadata": {"source": "pages.get"}
    },
    {
      "name": "public_ref",
      "state": "ready",
      "ready": true,
      "message": null,
      "latency_ms": 1,
      "metadata": {"route_kind": "hub_web"}
    }
  ],
  "metadata": {
    "profile": "surface",
    "source_ability": "pages.health",
    "rendering_owner": "backend"
  }
}
